{
  "$schema": "../protocol/cell.schema.json",
  "protocol_version": 1,
  "id": "governance.admission-gate",
  "name": "Admission Gate",
  "status": "active",
  "purpose": "Independently classify, inspect, review, contain, and admit repository mutations without granting candidate code authority over its own acceptance.",
  "scope": [
    "control-plane",
    ".github/workflows",
    ".github/CODEOWNERS",
    ".github/pull_request_template.md",
    "RULES.md",
    "AGENTS.md",
    "CONTRIBUTING.md",
    "SECURITY.md",
    "docs/ADMISSION_GATE.md",
    "docs/BOOTSTRAP.md",
    "docs/THREAT_MODEL.md",
    "docs/OWNER_AUTHORITY.md"
  ],
  "entrypoints": [
    "control-plane/static-gate.mjs",
    "control-plane/codex-gate-cli.mjs",
    ".github/workflows/policy-security.yml",
    ".github/workflows/validation.yml",
    ".github/workflows/codex-review.yml",
    ".github/workflows/arm-auto-merge.yml"
  ],
  "interfaces": [
    {
      "name": "trusted-static-admission",
      "kind": "cli-json",
      "contract": "static-gate.mjs receives a candidate directory, GitHub event JSON, and changed-file inventory; it emits an acceptance decision, findings, and risk classification without executing candidate code."
    },
    {
      "name": "adversarial-review-admission",
      "kind": "cli-json",
      "contract": "codex-gate-cli.mjs fails closed for high or critical mutations until an owner-approved reviewer identity or temporary owner-controlled review label supplies valid evidence."
    },
    {
      "name": "automatic-merge-arming",
      "kind": "github-actions",
      "contract": "Non-critical pull requests may have squash auto-merge armed; GitHub branch rules and required checks remain the final merge lock."
    }
  ],
  "depends_on": [
    "platform.repository-intelligence"
  ],
  "capabilities": [
    "verify-owner-only-law",
    "verify-pr-attestations",
    "enforce-denylist",
    "classify-mutation-risk",
    "scan-secrets-and-malicious-patterns",
    "reject-unexpected-binaries-and-symlinks",
    "require-adversarial-review",
    "execute-networkless-validation",
    "arm-safe-auto-merge"
  ],
  "read_first": [
    "RULES.md",
    "docs/ADMISSION_GATE.md",
    "docs/THREAT_MODEL.md",
    "control-plane/policy.json",
    "control-plane/static-gate.mjs",
    ".github/workflows/policy-security.yml",
    ".github/workflows/validation.yml"
  ],
  "validation": [
    "node --test control-plane/test/*.test.mjs",
    "npm run gate",
    "npm run catalog"
  ],
  "security": {
    "risk": "critical",
    "network": "Privileged workflows use GitHub API access only. Candidate execution is networkless. Dependency resolution remains a controlled bootstrap exception and cannot include community dependency changes.",
    "filesystem": "Privileged inspection reads candidate files as untrusted data. Candidate runtime receives a read-only repository mount and disposable tmpfs.",
    "subprocesses": "Trusted Node.js admission tools, GitHub CLI metadata reads, Docker runtime, and candidate test commands inside the restricted container.",
    "secrets": "No repository secrets are exposed to pull-request code. Privileged workflows use least-privilege GITHUB_TOKEN permissions and never execute candidate code."
  },
  "extension_points": [
    "Bind the exact installed Codex reviewer identity after owner verification.",
    "Move policy and scanner logic into a private observer repository or GitHub App.",
    "Add behavioral syscall and outbound-connection observation.",
    "Replace temporary owner review labels with signed Agent Gateway attestations."
  ],
  "decisions": [
    "docs/adr/0001-two-plane-architecture.md",
    "docs/adr/0002-federated-cell-architecture.md"
  ],
  "replaced_by": null,
  "metadata": {
    "generation_created": 0,
    "owner_only": true
  }
}
